{
  "schema_version": "portal.execution.maximum-data.e4.event-coverage.v1",
  "e2_semantic_registry_sha256": "sha256:c1886540c91e8e96219a12684e0b42651a061236128ab92f51442d0f56493477",
  "global_ordered_journal_status": "E2_NOT_PROVEN_NO_GLOBAL_SEQUENCE_RETENTION_OR_CORRECTION",
  "coverage": [
    { "event_type": "SIGNAL_INTENT_CREATED", "domain_id": "signal_sizing_risk", "status": "SOURCE_ABSENT", "replay_eligible": false, "source_basis": "NO_SIGNAL_INTENT_RELATION_OR_DURABLE_FUNNEL_PROVEN", "owner_action_id": "signal-intent-funnel" },
    { "event_type": "SIZING_REQUESTED", "domain_id": "signal_sizing_risk", "status": "CURRENT_STATE_ONLY", "replay_eligible": false, "source_basis": "SIZING_DECISION_RECORDS_WITHOUT_GLOBAL_ORDER", "owner_action_id": null },
    { "event_type": "SIZING_APPROVED", "domain_id": "signal_sizing_risk", "status": "CURRENT_STATE_ONLY", "replay_eligible": false, "source_basis": "SIZING_DECISION_RECORDS_WITHOUT_GLOBAL_ORDER", "owner_action_id": null },
    { "event_type": "SIZING_REDUCED", "domain_id": "signal_sizing_risk", "status": "CURRENT_STATE_ONLY", "replay_eligible": false, "source_basis": "SIZING_DECISION_RECORDS_WITHOUT_GLOBAL_ORDER", "owner_action_id": null },
    { "event_type": "SIZING_REJECTED", "domain_id": "signal_sizing_risk", "status": "CURRENT_STATE_ONLY", "replay_eligible": false, "source_basis": "SIZING_DECISION_RECORDS_WITHOUT_GLOBAL_ORDER", "owner_action_id": null },
    { "event_type": "RISK_CHECK_REQUESTED", "domain_id": "signal_sizing_risk", "status": "CURRENT_STATE_ONLY", "replay_eligible": false, "source_basis": "RISK_GRANT_AND_PROFILE_ROWS_WITHOUT_GLOBAL_ORDER", "owner_action_id": null },
    { "event_type": "RISK_APPROVED", "domain_id": "signal_sizing_risk", "status": "CURRENT_STATE_ONLY", "replay_eligible": false, "source_basis": "RISK_GRANT_RECORDS_WITHOUT_CORRECTION_STREAM", "owner_action_id": null },
    { "event_type": "RISK_REJECTED", "domain_id": "signal_sizing_risk", "status": "CURRENT_STATE_ONLY", "replay_eligible": false, "source_basis": "RISK_GRANT_RECORDS_WITHOUT_CORRECTION_STREAM", "owner_action_id": null },
    { "event_type": "RISK_LIMIT_CHANGED", "domain_id": "signal_sizing_risk", "status": "CURRENT_STATE_ONLY", "replay_eligible": false, "source_basis": "MUTABLE_RISK_PROFILE_WITHOUT_CHANGE_JOURNAL", "owner_action_id": null },
    { "event_type": "RISK_BREACH_OPENED", "domain_id": "signal_sizing_risk", "status": "SOURCE_ABSENT", "replay_eligible": false, "source_basis": "NO_RETAINED_RISK_BREACH_EVENT_SOURCE_PROVEN", "owner_action_id": "risk-event-correction" },
    { "event_type": "RISK_BREACH_RESOLVED", "domain_id": "signal_sizing_risk", "status": "SOURCE_ABSENT", "replay_eligible": false, "source_basis": "NO_RETAINED_RISK_BREACH_EVENT_SOURCE_PROVEN", "owner_action_id": "risk-event-correction" },
    { "event_type": "COMMAND_ACCEPTED", "domain_id": "commands_terminal_verification", "status": "DERIVABLE", "replay_eligible": false, "source_basis": "DURABLE_COMMAND_JOURNAL_FACTS_WITHOUT_GLOBAL_SEQUENCE", "owner_action_id": null },
    { "event_type": "COMMAND_DISPATCHED", "domain_id": "commands_terminal_verification", "status": "DERIVABLE", "replay_eligible": false, "source_basis": "COMMAND_DISPATCH_EVIDENCE_WITHOUT_GLOBAL_SEQUENCE", "owner_action_id": null },
    { "event_type": "COMMAND_ACKNOWLEDGED", "domain_id": "commands_terminal_verification", "status": "DERIVABLE", "replay_eligible": false, "source_basis": "COMMAND_ACK_EVIDENCE_WITH_SAFE_DTO_PENDING", "owner_action_id": null },
    { "event_type": "COMMAND_TERMINAL", "domain_id": "commands_terminal_verification", "status": "DERIVABLE", "replay_eligible": false, "source_basis": "TERMINAL_COMMAND_EVIDENCE_WITH_SAFE_DTO_PENDING", "owner_action_id": null },
    { "event_type": "ORDER_CREATED", "domain_id": "orders_fills_conditional_lifecycle", "status": "CURRENT_STATE_ONLY", "replay_eligible": false, "source_basis": "MUTABLE_ORDER_PROJECTION_WITHOUT_EVENT_SEQUENCE", "owner_action_id": null },
    { "event_type": "ORDER_SUBMITTED", "domain_id": "orders_fills_conditional_lifecycle", "status": "CURRENT_STATE_ONLY", "replay_eligible": false, "source_basis": "MUTABLE_ORDER_PROJECTION_WITHOUT_EVENT_SEQUENCE", "owner_action_id": null },
    { "event_type": "ORDER_SOURCE_ACKNOWLEDGED", "domain_id": "orders_fills_conditional_lifecycle", "status": "SOURCE_ABSENT", "replay_eligible": false, "source_basis": "SOURCE_ACK_CLOCK_NOT_PRESENT_IN_ORDER_PROJECTION", "owner_action_id": "order-broker-ack-clocks" },
    { "event_type": "ORDER_BROKER_ACKNOWLEDGED", "domain_id": "orders_fills_conditional_lifecycle", "status": "SOURCE_ABSENT", "replay_eligible": false, "source_basis": "BROKER_ACK_CLOCK_NOT_PRESENT_IN_ORDER_PROJECTION", "owner_action_id": "order-broker-ack-clocks" },
    { "event_type": "ORDER_REJECTED", "domain_id": "orders_fills_conditional_lifecycle", "status": "CURRENT_STATE_ONLY", "replay_eligible": false, "source_basis": "MUTABLE_ORDER_PROJECTION_WITHOUT_EVENT_SEQUENCE", "owner_action_id": null },
    { "event_type": "ORDER_REPLACE_REQUESTED", "domain_id": "orders_fills_conditional_lifecycle", "status": "CURRENT_STATE_ONLY", "replay_eligible": false, "source_basis": "MUTABLE_ORDER_PROJECTION_WITHOUT_EVENT_SEQUENCE", "owner_action_id": null },
    { "event_type": "ORDER_REPLACED", "domain_id": "orders_fills_conditional_lifecycle", "status": "CURRENT_STATE_ONLY", "replay_eligible": false, "source_basis": "MUTABLE_ORDER_PROJECTION_WITHOUT_EVENT_SEQUENCE", "owner_action_id": null },
    { "event_type": "CANCEL_REQUESTED", "domain_id": "orders_fills_conditional_lifecycle", "status": "CURRENT_STATE_ONLY", "replay_eligible": false, "source_basis": "MUTABLE_ORDER_PROJECTION_WITHOUT_EVENT_SEQUENCE", "owner_action_id": null },
    { "event_type": "ORDER_CANCELED", "domain_id": "orders_fills_conditional_lifecycle", "status": "CURRENT_STATE_ONLY", "replay_eligible": false, "source_basis": "MUTABLE_ORDER_PROJECTION_WITHOUT_EVENT_SEQUENCE", "owner_action_id": null },
    { "event_type": "ORDER_EXPIRED", "domain_id": "orders_fills_conditional_lifecycle", "status": "CURRENT_STATE_ONLY", "replay_eligible": false, "source_basis": "MUTABLE_ORDER_PROJECTION_WITHOUT_EVENT_SEQUENCE", "owner_action_id": null },
    { "event_type": "PARTIAL_FILL", "domain_id": "orders_fills_conditional_lifecycle", "status": "DERIVABLE", "replay_eligible": false, "source_basis": "FILL_FACTS_WITHOUT_GLOBAL_SEQUENCE_OR_CORRECTION_CONTRACT", "owner_action_id": null },
    { "event_type": "FILL", "domain_id": "orders_fills_conditional_lifecycle", "status": "DERIVABLE", "replay_eligible": false, "source_basis": "FILL_FACTS_WITHOUT_GLOBAL_SEQUENCE_OR_CORRECTION_CONTRACT", "owner_action_id": null },
    { "event_type": "FILL_CORRECTED", "domain_id": "orders_fills_conditional_lifecycle", "status": "SOURCE_ABSENT", "replay_eligible": false, "source_basis": "NO_AUTHORITATIVE_FILL_CORRECTION_JOURNAL_PROVEN", "owner_action_id": "fill-correction-replay" },
    { "event_type": "POSITION_UPDATED", "domain_id": "positions_exposure", "status": "CURRENT_STATE_ONLY", "replay_eligible": false, "source_basis": "MUTABLE_POSITION_CURRENT_STATE_WITHOUT_VERSION_HISTORY", "owner_action_id": null },
    { "event_type": "ACCOUNTING_UPDATED", "domain_id": "accounting_equity_performance_valuation", "status": "DERIVABLE", "replay_eligible": false, "source_basis": "ACCOUNTING_FACTS_AND_SNAPSHOTS_WITHOUT_GLOBAL_SEQUENCE", "owner_action_id": null },
    { "event_type": "EQUITY_SNAPSHOT", "domain_id": "accounting_equity_performance_valuation", "status": "DERIVABLE", "replay_eligible": false, "source_basis": "RETAINED_EQUITY_SNAPSHOT_FACTS_NOT_EVENT_REPLAY", "owner_action_id": null },
    { "event_type": "RECONCILIATION_FINDING_OPENED", "domain_id": "reconciliation_incidents_operational_truth", "status": "CURRENT_STATE_ONLY", "replay_eligible": false, "source_basis": "MUTABLE_RECONCILIATION_FINDING_LIFECYCLE", "owner_action_id": null },
    { "event_type": "RECONCILIATION_FINDING_RESOLVED", "domain_id": "reconciliation_incidents_operational_truth", "status": "CURRENT_STATE_ONLY", "replay_eligible": false, "source_basis": "MUTABLE_RECONCILIATION_FINDING_LIFECYCLE", "owner_action_id": null },
    { "event_type": "ALLOCATION_CHANGED", "domain_id": "portfolio_allocation_capital", "status": "CURRENT_STATE_ONLY", "replay_eligible": false, "source_basis": "CURRENT_ALLOCATION_ROWS_WITHOUT_CHANGE_JOURNAL", "owner_action_id": null },
    { "event_type": "BROKER_SYNC_STATE_CHANGED", "domain_id": "accounts_balances_margin_bindings_sync", "status": "CURRENT_STATE_ONLY", "replay_eligible": false, "source_basis": "CURRENT_SYNC_PROJECTION_WITHOUT_HISTORY_STREAM", "owner_action_id": null },
    { "event_type": "KILL_SWITCH_STATE_CHANGED", "domain_id": "reconciliation_incidents_operational_truth", "status": "SOURCE_ABSENT", "replay_eligible": false, "source_basis": "NO_TYPED_TRADING_SYSTEM_KILL_SWITCH_EVENT_SOURCE_PROVEN", "owner_action_id": "trading-system-kill-switch-event-source" }
  ]
}
